{
  "package": [
    {
      "name": "regen",
      "build": "v3",
      "version": "v5.0.0"
    },
    {
      "name": "osmosisd",
      "build": "v6",
      "version": "v14.0.0"
    },
    {
      "name": "gaiad",
      "build": "v2",
      "version": "v7.1.0"
    },
    {
      "name": "junod",
      "build": "v4",
      "version": "v11.0.0"
    },
    {
      "name": "akash",
      "build": "v4",
      "version": "v0.20.0"
    },
    {
      "name": "ag0",
      "build": "v3",
      "version": "agoric-upgrade-7-2"
    },
    {
      "name": "cheqd-noded",
      "build": "v3",
      "version": "v0.6.9"
    },
    {
      "name": "ixod",
      "build": "v3",
      "version": "v0.19.1"
    },
    {
      "name": "multisig",
      "build": "v2",
      "version": "v0.4.0"
    },
    {
      "name": "injectived",
      "build": "v2",
      "version": "v1.9.0"
    },
    {
      "name": "strided",
      "build": "v1",
      "version": "v4.0.2"
    },
    {
      "name": "panacead",
      "build": "v1",
      "version": "v2.0.5"
    },
    {
      "name": "quicksilverd",
      "build": "v1",
      "version": "v1.2.0"
    },
    {
      "name": "persistenceCore",
      "build": "v1",
      "version": "v6.1.0"
    },
    {
      "name": "axelar",
      "build": "v1",
      "version": "v0.31.2"
    },
    {
      "name": "okp4d",
      "build": "v1",
      "version": "v6.1.0"
    }
  ],
  "os": [
    "macos-12",
    "ubuntu-20.04"
  ],
  "network": [
    {
      "daemon_name": "gaiad",
      "chain_name": "cosmoshub",
      "codebase": {
        "recommended_version": "v7.1.0"
      }
    },
    {
      "daemon_name": "regen",
      "chain_name": "regen"
    },
    {
      "daemon_name": "osmosisd",
      "chain_name": "osmosis"
    },
    {
      "daemon_name": "junod",
      "chain_name": "juno"
    },
    {
      "daemon_name": "akash",
      "chain_name": "akash"
    },
    {
      "daemon_name": "ag0",
      "chain_name": "agoric",
      "codebase": {
        "recommended_version": "agoric-upgrade-7-2",
        "git_repo": "agoric/ag0"
      }
    },
    {
      "daemon_name": "cheqd-noded",
      "chain_name": "cheqd"
    },
    {
      "daemon_name": "ixod",
      "chain_name": "impacthub",
      "codebase": {
        "recommended_version": "v0.19.1"
      }
    },
    {
      "daemon_name": "nomic"
    },
    {
      "daemon_name": "injectived",
      "chain_name": "injective",
      "codebase": {
        "recommended_version": "v1.9.0",
        "git_repo": "InjectiveLabs/injective-core"
      }
    },
    {
      "daemon_name": "strided",
      "chain_name": "stride",
      "codebase": {
        "recommended_version": "v4.0.2"
        }
    },
    {
      "daemon_name": "panacead",
      "chain_name": "panacea"
    },
    {
      "daemon_name": "quicksilverd",
      "chain_name": "quicksilver"
    },
    {
      "daemon_name": "persistenceCore",
      "chain_name": "persistence"
    },
    {
      "daemon_name": "axelard",
      "chain_name": "axelar",
      "codebase": {
        "recommended_version": "v0.31.2"
      }
    }
  ],
  "tools": [
    {
      "name": "multisig",
      "ref": "v0.4.0",
      "git_url": "informalsystems/multisig"
    },
    {
      "name": "hermes",
      "ref": "v1.2.0",
      "git_url": "informalsystems/hermes"
    }
  ]
}
